{
  "adapter": {
    "skeleton": "contract-only"
  },
  "documentation": {
    "proven_support": [],
    "status": "scaffold"
  },
  "license": {
    "source": "LICENSE",
    "spdx_id": "GPL-3.0-only"
  },
  "nxextract_recipe": "extractor.json",
  "nxport": {
    "architecture": "aarch64",
    "argument_mode": "game-dir-and-passthrough",
    "enabled_quirks": [],
    "executable": "suzycube-nextos",
    "home_mode": "port",
    "id": "suzycube",
    "launcher_name": "Suzy Cube.sh",
    "nxextract": {
      "mode": "yes",
      "version": "1.2.10"
    },
    "prepare_script": "",
    "private_library_paths": [],
    "required_capabilities": [
      "host.portmaster",
      "host.aarch64-libs",
      "graphics.window",
      "graphics.gles2",
      "graphics.egl",
      "graphics.egl-config",
      "graphics.drawable",
      "audio.output-open",
      "input.controller-mapping",
      "input.controller-api"
    ],
    "required_files": [
      "suzycube-nextos",
      "lib/libmain.so",
      "lib/libunity.so",
      "lib/libil2cpp.so",
      "assets/bin/Data/boot.config",
      "assets/bin/Data/globalgamemanagers",
      "assets/bin/Data/Managed/Metadata/global-metadata.dat"
    ],
    "runtime_report": "log-and-logo",
    "schema_version": 2,
    "title": "Suzy Cube"
  },
  "portmaster": {
    "metadata_version": 4,
    "min_glibc": "2.27",
    "runtime": []
  },
  "schema_version": 2
}
