{
  "adapter": {
    "skeleton": "contract-only"
  },
  "documentation": {
    "proven_support": [],
    "status": "scaffold"
  },
  "license": {
    "source": "LICENSE",
    "spdx_id": "GPL-3.0-only"
  },
  "nxextract_recipe": "extractor.json",
  "nxport": {
    "architecture": "aarch64",
    "argument_mode": "none",
    "enabled_quirks": [],
    "executable": "terraria-nextos",
    "home_mode": "preserve",
    "id": "terraria",
    "launcher_name": "Terraria.sh",
    "nxextract": {
      "mode": "yes",
      "version": "1.2.18"
    },
    "prepare_script": "",
    "private_library_paths": [],
    "required_capabilities": [
      "host.portmaster",
      "graphics.window",
      "graphics.gles2",
      "graphics.egl",
      "graphics.egl-config",
      "graphics.drawable",
      "audio.output-open",
      "input.controller-mapping",
      "input.controller-api"
    ],
    "required_files": [
      "terraria-nextos",
      "nxsplash-nextos",
      "libunity.so",
      "libil2cpp.so",
      "libc++_shared.so",
      "bin/Data/boot.config",
      "bin/Data/data.unity3d",
      "bin/Data/Managed/Metadata/global-metadata.dat"
    ],
    "runtime_report": "log",
    "schema_version": 2,
    "title": "Terraria"
  },
  "portmaster": {
    "metadata_version": 4,
    "min_glibc": "2.27",
    "runtime": []
  },
  "schema_version": 2
}
