{
  "schema_version": 2,
  "nxport": {
    "schema_version": 2,
    "id": "nxexample-mixed-armhf",
    "title": "NXExample Mixed ARMHF",
    "launcher_name": "NXExample Mixed ARMHF.sh",
    "architecture": "armv7",
    "executable": "bin/armv7/nxexample-loader",
    "argument_mode": "game-dir-and-passthrough",
    "home_mode": "preserve",
    "nxextract": {
      "mode": "yes",
      "version": "1.3.0"
    },
    "required_files": [
      "bin/armv7/nxexample-loader"
    ],
    "private_library_paths": [
      "lib"
    ],
    "prepare_script": "",
    "required_capabilities": [
      "host.portmaster",
      "host.armhf-libs",
      "graphics.gles2",
      "input.controller-mapping"
    ],
    "enabled_quirks": [],
    "runtime_report": "log-and-logo",
    "execution_roles": {
      "extractor": {
        "architecture": "aarch64",
        "executable": "nxextract/nxextract-ui",
        "executor": "native",
        "interpreter": "/lib/ld-linux-aarch64.so.1",
        "closure": "host"
      },
      "splash": {
        "architecture": "armv7",
        "executable": "nxsplash-nextos",
        "executor": "native-or-loader",
        "interpreter": "/lib/ld-linux-armhf.so.3",
        "closure": "firmware"
      },
      "game": {
        "architecture": "armv7",
        "executable": "bin/armv7/nxexample-loader",
        "executor": "native-or-loader",
        "interpreter": "/lib/ld-linux-armhf.so.3",
        "closure": "firmware-and-port"
      },
      "helpers": []
    }
  },
  "nxextract_recipe": "suportando_outros_devices/extrator-universal/examples/recipe-minimal.json",
  "adapter": {
    "skeleton": "contract-only"
  },
  "portmaster": {
    "metadata_version": 4,
    "min_glibc": "2.17",
    "runtime": []
  },
  "license": {
    "spdx_id": "GPL-3.0-only",
    "source": "LICENSE"
  },
  "documentation": {
    "status": "scaffold",
    "proven_support": []
  }
}
